name,mbid,url,image_small,image
Maribou State,72034a05-bcd8-40c2-8255-3ee4ac0e7ef0,https://www.last.fm/music/Maribou+State,https://lastfm.freetls.fastly.net/i/u/34s/2a96cbd8b46e442fc41c2b86b821562f.png,https://lastfm.freetls.fastly.net/i/u/174s/2a96cbd8b46e442fc41c2b86b821562f.png
"Maribou State, Holly Walker",,"https://www.last.fm/music/Maribou+State,+Holly+Walker",,
Maribou State feat. Holly Walker,72034a05-bcd8-40c2-8255-3ee4ac0e7ef0,https://www.last.fm/music/Maribou+State+feat.+Holly+Walker,,
Maribou State & Pedestrian,,https://www.last.fm/music/Maribou+State+&+Pedestrian,https://lastfm.freetls.fastly.net/i/u/34s/2a96cbd8b46e442fc41c2b86b821562f.png,https://lastfm.freetls.fastly.net/i/u/174s/2a96cbd8b46e442fc41c2b86b821562f.png
"Maribou State, Khruangbin",,"https://www.last.fm/music/Maribou+State,+Khruangbin",,
maribou state & holly walker,,https://www.last.fm/music/maribou+state+&+holly+walker,,
"Maribou State, Pedestrian",,"https://www.last.fm/music/Maribou+State,+Pedestrian",,
Maribou State feat. Khruangbin,,https://www.last.fm/music/Maribou+State+feat.+Khruangbin,https://lastfm.freetls.fastly.net/i/u/34s/2a96cbd8b46e442fc41c2b86b821562f.png,https://lastfm.freetls.fastly.net/i/u/174s/2a96cbd8b46e442fc41c2b86b821562f.png
"Maribou State, North Downs",,"https://www.last.fm/music/Maribou+State,+North+Downs",,
Maribou State (feat. Holly Walker),,https://www.last.fm/music/Maribou+State+(feat.+Holly+Walker),,
Maribou State feat. Jono McCleery,,https://www.last.fm/music/Maribou+State+feat.+Jono+McCleery,,
Maribou State featuring Holly Walker,,https://www.last.fm/music/Maribou+State+featuring+Holly+Walker,,
Maribou State featuring Pedestrian,,https://www.last.fm/music/Maribou+State+featuring+Pedestrian,,
MARIBOU STATE & KHRUANGBIN,,https://www.last.fm/music/MARIBOU+STATE+&+KHRUANGBIN,,
Maribou State  feat. Holly Walker,,https://www.last.fm/music/Maribou+State++feat.+Holly+Walker,,
"Maribou State, Nubiya Brandon",,"https://www.last.fm/music/Maribou+State,+Nubiya+Brandon",,
Maribou State feat. Saint Saviour,72034a05-bcd8-40c2-8255-3ee4ac0e7ef0,https://www.last.fm/music/Maribou+State+feat.+Saint+Saviour,,
Maribou State Feat. Pedestrian,,https://www.last.fm/music/Maribou+State+Feat.+Pedestrian,,
Maribou State Featuring Jono McCleery,,https://www.last.fm/music/Maribou+State+Featuring+Jono+McCleery,,
"Pedestrian, Maribou State, Maribou State & Pedestrian",,"https://www.last.fm/music/Pedestrian,+Maribou+State,+Maribou+State+&+Pedestrian",,
Maribou State feat. North Downs,,https://www.last.fm/music/Maribou+State+feat.+North+Downs,,
Maribou State x Holly Walker,,https://www.last.fm/music/Maribou+State+x+Holly+Walker,,
Maribou State feat. Jimi Nxir,72034a05-bcd8-40c2-8255-3ee4ac0e7ef0,https://www.last.fm/music/Maribou+State+feat.+Jimi+Nxir,,
maribou state ft. holly walker,,https://www.last.fm/music/maribou+state+ft.+holly+walker,,
Maribou State x Pedestrian,,https://www.last.fm/music/Maribou+State+x+Pedestrian,,
Maribou State/Holly Walker,,https://www.last.fm/music/Maribou+State%2FHolly+Walker,,
"Maribou State, Jono McCleery",,"https://www.last.fm/music/Maribou+State,+Jono+McCleery",,
Maribou State ft. Nubiya Brandon,,https://www.last.fm/music/Maribou+State+ft.+Nubiya+Brandon,,
"Maribou State, Saint Saviour",,"https://www.last.fm/music/Maribou+State,+Saint+Saviour",,
Maribou State featuring Khruangbin,,https://www.last.fm/music/Maribou+State+featuring+Khruangbin,,
